Title,URL,Description,Regulation Number,Sector,Sub Sector,Regulation Type,Year,status
SEOJK tentang Saluran Pemasaran Produk Asuransi melalui Kerja Sama dengan Bank (Bancassurance),/id/regulasi/Pages/SEOJK-tentang-Saluran-Pemasaran-Produk-Asuransi-melalui-Kerja-Sama-dengan-Bank-(Bancassurance).aspx,SEOJK tentang Saluran Pemasaran Produk Asuransi melalui Kerja Sama dengan Bank (Bancassurance),32 /SEOJK.05/2016,IKNB,Asuransi,Surat Edaran OJK,2016,Success
POJK tentang Perubahan Atas Peraturan Otoritas Jasa Keuangan Nomor 6 /POJK.03/2016 tentang Transparansi dan Publikasi Laporan Bank,/id/regulasi/Pages/POJK-tentang-Perubahan-Atas-Peraturan-OJK-Nomor-6.POJK.03.2016-tentang-Transparansi-dan-Publikasi-Laporan-Bank.aspx,POJK tentang Perubahan Atas Peraturan Otoritas Jasa Keuangan Nomor 6 /POJK/03/2016 tentang Transparansi dan Publikasi Laporan Bank,32 /POJK.03/2016,Perbankan,Bank Umum,Peraturan OJK,2016,Success
SEOJK tentang Bentuk dan Isi Laporan Emiten atau Perusahaan Publik,/id/regulasi/Pages/SEOJK-tentang-Bentuk-dan-Isi-Laporan-Emiten-atau-Perusahaan-Publik.aspx,SEOJK tentang Bentuk dan Isi Laporan Emiten atau Perusahaan Publik,30 /SEOJK.04/2016,Pasar Modal,Emiten dan Perusahaan Publik,Surat Edaran OJK,2016,Success
Usaha Pergadaian,/id/regulasi/Pages/Usaha-Pergadaian.aspx,​Peraturan Otoritas Jasa Keuangan Nomor 31/POJK.05/2016 tentang Usaha Pergadaian.,31/POJK.05/2016,IKNB,Lembaga Pembiayaan,Peraturan OJK,2016,Success
Dana Investasi Real Estate Syariah Berbentuk Kontrak Investasi Kolektif,/id/regulasi/Pages/Dana-Investasi-Real-Estate-Syariah-Berbentuk-Kontrak-Investasi-Kolektif.aspx,​Peraturan Otoritas Jasa Keuangan Nomor 30/POJK.04/2016 Tentang Dana Investasi Real Estat Syariah Berbentuk Kontrak Investasi Kolektif.,30/POJK.04/2016,Pasar Modal,Pasar Modal Syariah,Peraturan OJK,2016,Success
POJK tentang Usaha Pergadaian,/id/regulasi/Pages/POJK-tentang-Usaha-Pegadaian.aspx,POJK tentang Usaha Pergadaian,31 /POJK.05/2016,IKNB,Lembaga Jasa Keuangan Khusus,Peraturan OJK,2016,Success
POJK tentang Dana Investasi Real Estat Syariah Berbentuk Kontrak Investasi Kolektif,/id/regulasi/Pages/POJK-tentang-Dana-Investasi-Real-Estat-Syariah-Berbentuk-Kontrak-Investasi-Kolektif.aspx,POJK tentang Dana Investasi Real Estat Syariah Berbentuk Kontrak Investasi Kolektif,30 /POJK.04/2016,Pasar Modal,Pasar Modal Syariah,Peraturan OJK,2016,Success
POJK tentang Laporan Tahunan Emiten atau Perusahaan Publik,/id/regulasi/Pages/POJK-tentang-Laporan-Tahunan-Emiten-atau-Perusahaan-Publik.aspx,POJK tentang Laporan Tahunan Emiten atau Perusahaan Publik,29 /POJK.04/2016,Pasar Modal,Emiten dan Perusahaan Publik,Peraturan OJK,2016,Success
POJK tentang Sistem Pengelolaan Investasi Terpadu,/id/regulasi/Pages/POJK-tentang-Sistem-Pengelolaan-Investasi-Terpadu.aspx,POJK tentang Sistem Pengelolaan Investasi Terpadu,28 /POJK.04/2016,Pasar Modal,"Reksa Dana, Perusahaan Efek, Wakil Perusahaan Efek, Penasehat Investasi, Agen Penjual Reksadana",Peraturan OJK,2016,Success
SEOJK tentang Pencabutan Surat Edaran Otoritas Jasa Keuangan Nomor 26 /SEOJK.05/2015 tentang Penilaian Investasi Surat Berharga bagi Dana Pensiun,/id/regulasi/Pages/SEOJK-tentang-Pencabutan-SEOJK-Nomor-26.SEOJK.05.2015-tentang-Penilaian-Investasi-Surat-Berharga-Dana-Pensiun.aspx,SEOJK tentang Pencabutan Surat Edaran Otoritas Jasa Keuangan Nomor 26 /SEOJK.05/2015 tentang Penilaian Investasi Surat Berharga bagi Dana Pensiun,23 /SEOJK.05/2016,IKNB,Dana Pensiun,Surat Edaran OJK,2016,Success
POJK tentang Penilaian Kemampuan dan Kepatutan bagi Pihak Utama Lembaga Jasa Keuangan,/id/regulasi/Pages/POJK-tentang-Penilaian-Kemampuan-dan-Kepatutan-bagi-Pihak-Utama-Lembaga-Jasa-Keuangan.aspx,POJK tentang Penilaian Kemampuan dan Kepatutan bagi Pihak Utama Lembaga Jasa Keuangan,27 /POJK.03/2016,Perbankan,Bank Umum,Peraturan OJK,2016,Success
"SEOJK tentang Bentuk dan Tata Cara Permohonan, Penyampaian Laporan, dan Program Pendidikan Berkelanjutan Konsultan Aktuara, Akuntan Publik, dan Penilaian yang Melakukan Kegiatan di Industri Keuangan Non-Bank",/id/regulasi/Pages/SEOJK-tentang-Bentuk-dan-Tata-Cara-Permohonan.Penyampaian-Laporan.dan-Program-Pendidikan-Berkelanjutan.aspx,"SEOJK tentang Bentuk dan Tata Cara Permohonan, Penyampaian Laporan, dan Program Pendidikan Berkelanjutan Konsultan Aktuara, Akuntan Publik, dan Penilaian yang Melakukan Kegiatan di Industri Keuangan Non-Bank",29 /SEOJK.05/2016,IKNB,"Lembaga Pembiayaan, Lembaga Jasa Keuangan Khusus",Surat Edaran OJK,2016,Success
POJK tentang Produk Investasi di Bidang Pasar Modal dalam Rangka Mendukung Undang-Undang tentang Pengampunan Pajak,/id/regulasi/Pages/POJK-tentang-Produk-Investasi-di-Bidang-Pasar-Modal-dalam-Rangka-Mendukung-Undang-Undang-tentang-Pengampunan-Pajak.aspx,POJK tentang Produk Investasi di Bidang Pasar Modal dalam Rangka Mendukung Undang-Undang tentang Pengampunan Pajak,26 /POJK.04/2016,Pasar Modal,"Bursa Efek, Reksa Dana, Perusahaan Efek, Wakil Perusahaan Efek, Penasehat Investasi, Dokumen Publik dan Laporan",Peraturan OJK,2016,Success
SEOJK tentang Pembukaan Jaringan Kantor Bank Umum Syariah dan Unit Usaha Syariah Berdasarkan Modal Inti,/id/regulasi/Pages/SEOJK-tentang-Pembukaan-Jaringan-Kantor-Bank-Umum-Syariah-dan-Unit-Usaha-Syariah-Berdasarkan-Modal-Inti.aspx,SEOJK tentang Pembukaan Jaringan Kantor Bank Umum Syariah dan Unit Usaha Syariah Berdasarkan Modal Inti,28 /SEOJK.03/2016,Perbankan,"Bank Umum, Perbankan Syariah",Surat Edaran OJK,2016,Success
POJK tentang Perubahan Atas Peraturan Otoritas Jasa Keuangan Nomor 27 /POJK.03/2015 tentang Kegiatan Usaha berupa Penitipan dengan Pengelolaan (Trust),/id/regulasi/Pages/POJK-tentang-Perubahan-Atas-Peraturan-OJK-Nomor-27.POJK.03.2015-tentang-Kegiatan-Usaha-Berupa-Penitipan-dengan-Pengelolaan.aspx,POJK tentang Perubahan Atas Peraturan Otoritas Jasa Keuangan Nomor 27 /POJK.03/2015 tentang Kegiatan Usaha berupa Penitipan dengan Pengelolaan (Trust),25 /POJK.03/2016,Perbankan,Bank Umum,Peraturan OJK,2016,Success
SEOJK tentang Kewajiban Penyediaan Modal Minimum Sesuai Profil Risiko dan Pemenuhan Capital Equivalency Maintaned Assets,/id/regulasi/Pages/SEOJK-tentang-Kewajiban-Penyediaan-Modal-Minimum-Sesuai-Profil-Risiko-dan-Pemenuhan-Capital-Equivalency-Maintaned-Assets.aspx,SEOJK tentang Kewajiban Penyediaan Modal Minimum Sesuai Profil Risiko dan Pemenuhan Capital Equivalency Maintaned Assets,26 /SEOJK.03/2016,Perbankan,Bank Umum,Surat Edaran OJK,2016,Success
SEOJK tentang Rencana Bisnis Bank Umum ,/id/regulasi/Pages/SEOJK-tentang-Rencana-Bisnis-Bank-Umum-.aspx,SEOJK tentang Rencana Bisnis Bank Umum,25 /SEOJK.03/2016,Perbankan,Bank Umum,Surat Edaran OJK,2016,Success
SEOJK tentang Perhitungan Aset Tertimbang Menurut Risiko untuk Risiko Operasional dengan Menggunakan Pendekatan Indokator Dasar,/id/regulasi/Pages/SEOJK-tentang-Perhitungan-Aset-Tertimbang-Menurut-Risiko-untuk-Risiko-Operasional-Menggunakan-Pendekatan-Indokator-Dasar.aspx,SEOJK tentang Perhitungan Aset Tertimbang Menurut Risiko untuk Risiko Operasional dengan Menggunakan Pendekatan Indokator Dasar,24 /SEOJK.03/2016,Perbankan,"Bank Umum, BPR, Perbankan Syariah",Surat Edaran OJK,2016,Success
SEOJK tentang Kegiatan Usaha Bank Umum Berdasarkan Modal Inti,/id/regulasi/Pages/SEOJK-tentang-Kegiatan-Usaha-Bank-Umum-Berdasarkan-Modal-Inti.aspx,SEOJK tentang Kegiatan Usaha Bank Umum Berdasarkan Modal Inti,27 /SEOJK.03/2016,Perbankan,Bank Umum,Surat Edaran OJK,2016,Success
Tingkat Kesehatan Keuangan Pembiayaan Syariah,/id/regulasi/Pages/Tingkat-Kesehatan-Keuangan-Pembiayaan-Syariah.aspx,​​Surat Edaran Otoritas Jasa Keuangan Nomor 2/SEOJK.5/2016 tentang Tingkat Kesehatan Keuangan Pembiayaan Syariah.,2/SEOJK.5/2016,IKNB,"IKNB Syariah, Lembaga Pembiayaan, Peraturan Lainnya",Surat Edaran OJK,2016,Success
POJK tentang Agen Perantara Pedagang Efek,/id/regulasi/Pages/POJK-tentang-Agen-Perantara-Pedagang-Efek.aspx,POJK tentang Agen Perantara Pedagang Efek,24 /POJK.04/2016,Pasar Modal,"Perusahaan Efek, Wakil Perusahaan Efek",Peraturan OJK,2016,Success
SEOJK tentang Pencabutan Surat Edaran Otoritas Jasa Keuangan Nomor 25 /POJK.05/2015 tentang Penilaian Investasi Surat Berharga Syariah dan Perhitungan Dana untuk Mengantisipasi Risiko Kegagalan Pengelolaan Kekayaan dan/atau Kewajiban Perusahaan Asuransi ,/id/regulasi/Pages/SEOJK-tentang-Pencabutan-SEOJK-Nomor-25.SEOJK.05.2015-tentang-Penilaian-Investasi-Surat-Berharga-Syariah-dan-Perhitungan-.aspx,SEOJK tentang Pencabutan  Surat Edaran Otoritas Jasa Keuangan Nomor 25 /POJK.05/2015 tentang Penilaian Investasi Surat Berharga Syariah dan Perhitungan Dana untuk Mengantisipasi Risiko Kegagalan Pengelolaan Kekayaan dan/atau Kewajiban Perusahaan Asuransi,22 /SEOJK.05/2016,IKNB,"IKNB Syariah, Asuransi",Surat Edaran OJK,2016,Success
SEOJK tentang Pencabutan Surat Edaran Otoritas Jasa Keuangan Nomor 24/SEOJK.05/2015 tentang Penilaian Investasi Surat Utang dan Penyesuaian Modal Minimum Berbasis Risiko bagi Perusahaan Asuransi dan Perusahaan Reasuransi,/id/regulasi/Pages/SEOJK-tentang-Pencabutan-SEOJK-Nomor-24.SEOJK.05.2015-tentang-Penilaian-Investasi-Surat-Utang-dan-Penyesuaian-Modal-Minimum.aspx,SEOJK tentang Pencabutan Surat Edaran Otoritas Jasa Keuangan Nomor 24/SEOJK.05/2015 tentang Penilaian Investasi Surat Utang dan Penyesuaian Modal Minimum Berbasis Risiko bagi Perusahaan Asuransi dan Perusahaan Reasuransi,21 /SEOJK.05/2016,IKNB,Asuransi,Surat Edaran OJK,2016,Success
Fitur Konversi Menjadi Saham Biasa atau Write Down Terhadap Instrumen Modal Inti Tambahan dan Modal Pelengkap,/id/regulasi/Pages/Fitur-Konversi-Menjadi-Saham-Biasa-atau-Write-Down-Terhadap-Instrumen-Modal-Inti-Tambahan-dan-Modal-Pelengkap.aspx,​Surat Edaran Otoritas Jasa Keuangan Nomor 20/SEOJK.03/2016 Tentang Fitur Konversi Menjadi Saham Biasa Atau Write Down Terhadap Instrumen Modal Inti Tambahan Dan Modal Pelengkap.,20/SEOJK.03/2016,Perbankan,Peraturan Lainnya,Surat Edaran OJK,2016,Success
SEOJK tentang Pemenuhan Ketentuan Bank Perkreditan Rakyat dan Transformasi Badan Kredit Desa yang Diberikan Status sebagai Bank Perkreditan Rakyat,/id/regulasi/Pages/SEOJK-tentang-Pemenuhan-Ketentuan-Bank-Perkreditan-Rakyat-dan-Transformasi-Badan-Kredit-Desa-yang-Diberikan-Status.aspx,SEOJK tentang Pemenuhan Ketentuan Bank Perkreditan Rakyat dan Transformasi Badan Kredit Desa yang Diberikan Status sebagai Bank Perkreditan Rakyat,19 /SEOJK.03/2016,Perbankan,BPR,Surat Edaran OJK,2016,Success
Laporan Bulanan Perusahaan Pembiayaan Syariah dan Unit Usaha Syariah dari Perusahaan Pembiayaan,/id/regulasi/Pages/Laporan-Bulanan-Perusahaan-Pembiayaan-Syariah-dan-Unit-Usaha-Syariah-dari-Perusahaan-Pembiayaan.aspx,​​Surat Edaran Otoritas Jasa Keuangan Nomor 4/SEOJK.5/2016​ tentang Laporan Bulanan Perusahaan Pembiayaan Syariah dan Unit Usaha Syariah dari Perusahaan Pembiayaan.,4/SEOJK.5/2016,IKNB,"IKNB Syariah, Lembaga Pembiayaan",Surat Edaran OJK,2016,Success
Pelaporan Produk Asuransi Bagi Perusahaan Asuransi Syariah dan Perusahaan Asuransi yang Menyelenggarakan Sebagian Usahanya,/id/regulasi/Pages/Pelaporan-Produk-Asuransi-Bagi-Perusahaan-Asuransi-Syariah-dan-Perusahaan-Asuransi-yang-Menyelenggarakan-Sebagian-Usahanya.aspx,​​​Surat Edaran Otoritas Jasa Keuangan Nomor 18/SEOJK.05/2016 tentang Pelaporan Produk Asuransi Bagi Perusahaan Asuransi Syariah dan Perusahaan Asuransi yang Menyelenggarakan Sebagian Usahanya Berdasarkan Prinsip Syariah.,18/SEOJK.05 /2016,IKNB,"Asuransi, Peraturan Lainnya",Surat Edaran OJK,2016,Success
SEOJK tentang Pelaporan Produk Asuransi bagi Perusahaan Asuransi Syariah dan Perusahaan Asuransi yang Menyelenggarakan Sebagian Usahanya Berdasarkan Prinsip Syariah,/id/regulasi/Pages/SEOJK-tentang-Pelaporan-Produk-Asuransi-bagi-Perusahaan-Asuransi-Syariah.aspx,SEOJK tentang Pelaporan Produk Asuransi bagi Perusahaan Asuransi Syariah dan Perusahaan Asuransi yang Menyelenggarakan Sebagian Usahanya Berdasarkan Prinsip Syariah,18 /SEOJK.05/2016,IKNB,IKNB Syariah,Surat Edaran OJK,2016,Success
SEOJK tentang Pengakuan terhadap Asosiasi Wakil Penjamin Emisi Efek dan Wakil Perantara Pedagang Efek,/id/regulasi/Pages/SEOJK-tentang-Pengakuan-terhadap-Asosiasi-Wakil-Penjamin-Emisi-Efek-dan-Wakil-Perantara-Pedagang-Efek.aspx,SEOJK tentang Pengakuan terhadap Asosiasi Wakil Penjamin Emisi Efek dan Wakil Perantara Pedagang Efek,17 /SEOJK.04/2016,Pasar Modal,"Perusahaan Efek, Wakil Perusahaan Efek",Surat Edaran OJK,2016,Success
Peraturan Bank Indonesia tentang Penetapan Status dan Tindak Lanjut Pengawasan Bank Umum Konvensional,/id/regulasi/Pages/PBI-tentang-Penetapan-Status-dan-Tindak-Lanjut-Pengawasan-Bank-Umum-Konvensional.aspx,Peraturan Bank Indonesia tentang Penetapan Status dan Tindak Lanjut Pengawasan Bank Umum Konvensional,15/2/PBI/2013,Perbankan,Bank Umum,PPBI,2016,Success
SEOJK tentang Pengakuan terhadap Asosiasi Wakil Manajer Investasi,/id/regulasi/Pages/SEOJK-tentang-Pengakuan-terhadap-Asosiasi-Wakil-Manajer-Investasi.aspx,SEOJK tentang Pengakuan terhadap Asosiasi Wakil Manajer Investasi,16 /SEOJK.04/2016,Pasar Modal,Penasehat Investasi,Surat Edaran OJK,2016,Success
SEOJK tentang Laporan Penerapan Tata Kelola Perusahaan yang Baik bagi Perusahaan Pembiayaan,/id/regulasi/Pages/SEOJK-tentang-Laporan-Penerapan-Tata-Kelola-Perusahaan-yang-Baik-bagi-Perusahaan-Pembiayaan.aspx,SEOJK tentang Laporan Penerapan Tata Kelola Perusahaan yang Baik bagi Perusahaan Pembiayaan,15 /SEOJK.05/2016,IKNB,Lembaga Pembiayaan,Surat Edaran OJK,2016,Success
SEOJK tentang Pembukaan Jaringan Kantor Bank Umum Berdasarkan Modal Inti,/id/regulasi/Pages/SEOJK-tentang-Pembukaan-Jaringan-Kantor-Bank-Umum-Berdasarkan-Modal-Inti.aspx,SEOJK tentang Pembukaan Jaringan Kantor Bank Umum Berdasarkan Modal Inti,14 /SEOJK.03/2016,Perbankan,Bank Umum,Surat Edaran OJK,2016,Success
POJK tentang Segmentasi Perizinan Wakil Perantara Pedagang Efek,/id/regulasi/Pages/POJK-tentang-Segmentasi-Perizinan-Wakil-Perantara-Pedagang-Efek.aspx,POJK tentang Segmentasi Perizinan Wakil Perantara Pedagang Efek,22 /POJK.04/2016,Pasar Modal,Wakil Perusahaan Efek,Peraturan OJK,2016,Success
SEOJK tentang Pelaporan Produk Asuransi bagi Perusahaan Asuransi,/id/regulasi/Pages/SEOJK-tentang-Pelaporan-Produk-Asuransi-bagi-Perusahaan-Asuransi.aspx,SEOJK tentang Pelaporan Produk Asuransi bagi Perusahaan Asuransi,13/SEOJK.05/2016,IKNB,Asuransi,Surat Edaran OJK,2016,Success
POJK tentang Reksa Dana Berbentuk Kontrak Investasi Kolektif,/id/regulasi/Pages/POJK-tentang-Reksa-Dana-Berbentuk-Kontrak-Investasi-Kolektif.aspx,POJK tentang Reksa Dana Berbentuk Kontrak Investasi Kolektif,23 /POJK.04/2016,Pasar Modal,Reksa Dana,Peraturan OJK,2016,Success
SEOJK tentang Persyaratan Pengetahuan di Bidang Dana Pensiun serta Tata Cara Pemenuhannya bagi Pengurus Dana Pensiun Pemberi Kerja dan Pelaksana Tugas Pengurus Dana Pensiun Lembaga Keuangan,/id/regulasi/Pages/SEOJK-tentang-Persyaratan-Pengetahuan-di-Bidang-Dana-Pensiun-serta-Tata-Cara-Pemenuhannya-bagi-Pengurus-Dana-Pensiun.aspx,SEOJK tentang Persyaratan Pengetahuan di Bidang Dana Pensiun serta Tata Cara Pemenuhannya bagi Pengurus Dana Pensiun Pemberi Kerja dan Pelaksana Tugas Pengurus Dana Pensiun Lembaga Keuangan,12 /SEOJK.05/2016,IKNB,Dana Pensiun,Surat Edaran OJK,2016,Success
SEOJK tentang Bentuk dan Susunan Laporan Teknis Dana Pensiun,/id/regulasi/Pages/SEOJK-tentang-Bentuk-dan-Susunan-Laporan-Teknis-Dana-Pensiun.aspx,SEOJK tentang Bentuk dan Susunan Laporan Teknis Dana Pensiun,11 /SEOJK.05/2016,IKNB,Dana Pensiun,Surat Edaran OJK,2016,Success
POJK tentang Pendaftaran Penilai Pemerintah untuk Tujuan Revaluasi Aset bagi Badan Usaha Milik Negara atau Badan Usaha Milik Daerah yang Melakukan Penawaran Umum di Pasar Modal,/id/regulasi/Pages/POJK-tentang-Pendaftaran-Penilai-Pemerintah-untuk-Tujuan-Revaluasi-Aset-bagi-BUMN-atau-BUMD-yang-Melakukan-Penawaran-Umum-.aspx,POJK tentang Pendaftaran Penilai Pemerintah untuk Tujuan Revaluasi Aset bagi Badan Usaha Milik Negara atau Badan Usaha Milik Daerah yang Melakukan Penawaran Umum di Pasar Modal,21 /POJK.04/2016,Pasar Modal,Lembaga Penunjang Pasar Modal,Peraturan OJK,2016,Success
POJK tentang Perizinan Perusahaan Efek yang Melakukan Kegiatan Usaha sebagai Penjamin Emisi Efek dan Perantara Pedagang Efek,/id/regulasi/Pages/POJK-tentang-Perizinan-Perusahaan-Efek-yang-Melakukan-Kegiatan-Usaha-sebagai-Penjamin-Emisi-Efek-dan-Perantara-Pedagang.aspx,POJK tentang Perizinan Perusahaan Efek yang Melakukan Kegiatan Usaha sebagai Penjamin Emisi Efek dan Perantara Pedagang Efek,20 /POJK.04/2016,Pasar Modal,Perusahaan Efek,Peraturan OJK,2016,Success
Undang-Undang Republik Indonesia tentang Pencegahan dan Penanganan Krisis Sistem Keuangan,/id/regulasi/Pages/UU-Republik-Indonesia-tentang-Pencegahan-dan-Penanganan-Krisis-Sistem-Keuangan.aspx,Undang-Undang Republik Indonesia tentang Pencegahan dan Penanganan Krisis Sistem Keuangan,9 Tahun 2016,Perbankan,"Bank Umum, BPR, Perbankan Syariah",Undang-Undang,2016,Success
SEOJK tentang Pedoman Penerapan Manajemen Risiko dan Laporan Hasil Penilaian Sendiri Penerapan Manajemen Risiko bagi Lembaga Jasa Keuangan Non-Bank,/id/regulasi/Pages/SEOJK-tentang-Pedoman-dan-Laporan-Hasil-Penilaian-Sendiri-Penerapan-Manajemen-Risiko-bagi-LJK-Non-Bank.aspx,SEOJK tentang Pedoman Penerapan Manajemen Risiko dan Laporan Hasil Penilaian Sendiri Penerapan Manajemen Risiko bagi Lembaga Jasa Keuangan Non-Bank,10 /SEOJK.05/2016,IKNB,"Asuransi, Dana Pensiun, Lembaga Pembiayaan, Lembaga Jasa Keuangan Khusus, Lembaga Keuangan Mikro",Surat Edaran OJK,2016,Success
"SEOJK tentang Dasar Penilaian Investasi Dana Pensiun, Bentuk dan Susunan serta Tata Cara Penyampaian Laporan Investasi Dana Pensiun","/id/regulasi/Pages/SEOJK-tentang-Dasar-Penilaian-Investasi-Dana-Pensiun,-Bentuk-dan-Susunan-serta-Tata-Cara-Penyampaian-Laporan-Investasi.aspx","SEOJK tentang Dasar Penilaian Investasi Dana Pensiun, Bentuk dan Susunan serta Tata Cara Penyampaian Laporan Investasi Tahunan Dana Pensiun",9 /SEOJK.05/2016,IKNB,Dana Pensiun,Surat Edaran OJK,2016,Success
POJK tentang Pedoman bagi Manajer Investasi dan Bank Kustodian yang Melakukan Pengelolaan Dana Investasi Real Estate,/id/regulasi/Pages/POJK-tentang-Pedoman-bagi-Manajer-Investasi-dan-Bank-Kustodian-yang-Melakukan-Pengelolaan-Dana-Investasi-Real-Estate.aspx,POJK tentang Pedoman bagi Manajer Investasi dan Bank Kustodian yang Melakukan Pengelolaan Dana Investasi Real Estate,19 /POJK.04/2016,Pasar Modal,Peraturan Lainnya,Peraturan OJK,2016,Success
POJK tentang Penerapan Manajemen Resiko bagi Bank Umum,/id/regulasi/Pages/POJK-tentang-Penerapan-Manajemen-Resiko-bagi-Bank-Umum.aspx,POJK tentang Penerapan Manajemen Resiko bagi Bank Umum,18 /POJK.03/2016,Perbankan,Bank Umum,Peraturan OJK,2016,Success
POJK tentang Pedoman Tata Kelola Dana Pensiun,/id/regulasi/Pages/POJK-tentang-Pedoman-Tata-Kelola-Dana-Pensiun.aspx,POJK tentang Pedoman Tata Kelola Dana Pensiun,16 /POJK.05/2016,IKNB,Dana Pensiun,Peraturan OJK,2016,Success
SEOJK tentang Kewajiban Penyediaan Modal Minimum dan Pemenuhan Modal Inti Minimum Bank Perkreditan Rakyat,/id/regulasi/Pages/SEOJK-tentang-Kewajiban-Penyediaan-Modal-Minimum-dan-Pemenuhan-Modal-Inti-Minimum-Bank-Perkreditan-Rakyat.aspx,SEOJK tentang Kewajiban Penyediaan Modal Minimum dan Pemenuhan Modal Inti Minimum Bank Perkreditan Rakyat,8 /SEOJK.03/2016,Perbankan,BPR,Surat Edaran OJK,2016,Success
SEOJK tentang Standar Pelaksanaan Fungsi Audit Intern Bank Perkreditan Rakyat,/id/regulasi/Pages/SEOJK-tentang-Standar-Pelaksanaan-Fungsi-Audit-Intern-Bank-Perkreditan-Rakyat.aspx,SEOJK tentang Standar Pelaksanaan Fungsi Audit Intern Bank Perkreditan Rakyat,7 /SEOJK.03/2016,Perbankan,BPR,Surat Edaran OJK,2016,Success
SEOJK tentang Penerapan Fungsi Kepatuhan bagi Bank Perkreditan Rakyat,/id/regulasi/Pages/SEOJK-tentang-Penerapan-Fungsi-Kepatuhan-bagi-Bank-Perkreditan-Rakyat.aspx,SEOJK tentang Penerapan Fungsi Kepatuhan bagi Bank Perkreditan Rakyat,6 /SEOJK.03/2016,Perbankan,BPR,Surat Edaran OJK,2016,Success
SEOJK tentang Penerapan Tata Kelola bagi Bank Perkreditan Rakyat,/id/regulasi/Pages/SEOJK-tentang-Penerapan-Tata-Kelola-Bagi-Bank-Perkreditan-Rakyat.aspx,SEOJK tentang Penerapan Tata Kelola bagi Bank Perkreditan Rakyat,5 /SEOJK.03/2016,Perbankan,BPR,Surat Edaran OJK,2016,Success
SEOJK tentang Laporan Bulanan Perusahaan Pembiayaan,/id/regulasi/Pages/SEOJK-tentang-Laporan-Bulanan-Perusahaan-Pembiayaan-Tahun-2016.aspx,SEOJK tentang Laporan Bulanan Perusahaan Pembiayaan,3/SEOJK.05/2016,IKNB,"Asuransi, Dana Pensiun, Lembaga Pembiayaan, Lembaga Jasa Keuangan Khusus, Lembaga Keuangan Mikro",Surat Edaran OJK,2016,Success
SEOJK tentang Laporan Bulanan Perusahaan Pembiayaan Syariah dan Unit Usaha Syariah dari Perusahaan Pembiayaan,/id/regulasi/Pages/SEOJK-tentang-Laporan-Bulanan-Perusahaan-Pembiayaan-Syariah-dan-Unit-Usaha-Syariah-dari-Perusahaan-Pembiayaan.aspx,SEOJK tentang Laporan Bulanan Perusahaan Pembiayaan Syariah dan Unit Usaha Syariah dari Perusahaan Pembiayaan,4/SEOJK.05/2016,IKNB,IKNB Syariah,Surat Edaran OJK,2016,Success
POJK tentang Laporan Teknis Dana Pensiun ,/id/regulasi/Pages/POJK-tentang-Laporan-Teknis-Dana-Pensiun-.aspx,POJK tentang Laporan Teknis Dana Pensiun,17 /POJK.05/2016,IKNB,Dana Pensiun,Peraturan OJK,2016,Success
POJK tentang Persyaratan Pengurus dan Dewan Pengawas Dana Pensiun Pemberi Kerja dan Pelaksana Tugas Pengurus Dana Pensiun Lembaga Keuangan,/id/regulasi/Pages/POJK-tentang-Persyaratan-Pengurus-dan-Dewan-Pengawas-Dana-Pensiun-Pemberi-Kerja-dan-Pelaksana-Tugas-Pengurus-Dana-Pensiun.aspx,POJK tentang Persyaratan Pengurus dan Dewan Pengawas Dana Pensiun Pemberi Kerja dan Pelaksana Tugas Pengurus Dana Pensiun Lembaga Keuangan,15 /POJK.05/2016,IKNB,Dana Pensiun,Peraturan OJK,2016,Success
POJK tentang Tata Cara Permohonan Pengesahan Pembentukan Dana Pensiun Pemberi Kerja dan Pengesahan Atas Perubahan Peraturan,/id/regulasi/Pages/POJK-tentang-Tata-Cara-Permohonan-Pengesahan-Pembentukan-Dana-Pensiun-Pemberi-Kerja-dan-Pengesahan-atau-Perubahan-Peraturan.aspx,POJK tentang Tata Cara Permohonan Pengesahan Pembentukan Dana Pensiun Pemberi Kerja dan Pengesahan Atas Perubahan Peraturan Dana Pensiun dari Dana Pensiun Pemberian Kerja,13 /POJK.03/2016,IKNB,Dana Pensiun,Peraturan OJK,2016,Success
SEOJK tentang Tingkat Kesehatan Keuangan Pembiayaan Syariah,/id/regulasi/Pages/SEOJK-tentang-Tingkat-Kesehatan-Keuangan-Pembiayaan-Syariah.aspx,SEOJK tentang Tingkat Kesehatan Keuangan Pembiayaan Syariah,2 /SEOJK.05/2016,IKNB,IKNB Syariah,Surat Edaran OJK,2016,Success
SEOJK tentang Tingkat Kesehatan Keuangan Perusahaan Pembiayaan,/id/regulasi/Pages/SEOJK-tentang-Tingkat-Kesehatan-Keuangan-Perusahaan-Pembiayaan.aspx,SEOJK tentang Tingkat Kesehatan Keuangan Perusahaan Pembiayaan,1 /SEOJK.05/2016,IKNB,"Asuransi, Dana Pensiun, Lembaga Pembiayaan, Lembaga Jasa Keuangan Khusus, Lembaga Keuangan Mikro",Surat Edaran OJK,2016,Success
POJK tentang Kewajiban Penyediaan Modal Minimum Bank Umum ,/id/regulasi/Pages/POJK-tentang-Kewajiban-Penyediaan-Modal-Minimum-Bank-Umum-.aspx,POJK tentang Kewajiban Penyediaan Modal Minimum Bank Umum,11 /POJK.03/2016,Perbankan,Bank Umum,Peraturan OJK,2016,Success
POJK tentang Pemenuhan Ketentuan Bank Perkreditan Rakyat dan Transformasi Badan Kredit Desa ,/id/regulasi/Pages/POJK-tentang-Pemenuhan-Ketentuan-Bank-Perkreditan-Rakyat-dan-Transformasi-Badan-Kredit-Desa-.aspx,POJK tentang Pemenuhan Ketentuan Bank Perkreditan Rakyat dan Transformasi Badan Kredit Desa yang Diberikan Status sebagai Bank Perkreditan Rakyat,10 /POJK.03/2016,Perbankan,BPR,Peraturan OJK,2016,Success
POJK tentang Prinsip Kehati-hatian bagi Bank Umum yang Melakukan Penyerahan Sebagian Pelaksanaan Pekerjaan kepada Pihak Lain ,/id/regulasi/Pages/POJK-tentang-Prinsip-Kehati-hatian-bagi-Bank-Umum.aspx,POJK tentang Prinsip Kehati-hatian bagi Bank Umum yang Melakukan Penyerahan Sebagian Pelaksanaan Pekerjaan kepada Pihak Lain,9 /POJK.03/2016,Perbankan,"Bank Umum, Perbankan Syariah",Peraturan OJK,2016,Success
POJK tentang Prinsip Kehati-hatian dalam Melaksanakan Aktivitas Keagenan Produk Keuangan Luar Negeri oleh Bank Umum,/id/regulasi/Pages/POJK-tentang-Prinsip-Kehati-hatian-dalam-Melaksanakan-Aktivitas-Keagenan-Produk-Keuangan-Luar-Negeri-oleh-Bank-Umum.aspx,POJK tentang Prinsip Kehati-hatian dalam Melaksanakan Aktivitas Keagenan Produk Keuangan Luar Negeri oleh Bank Umum,8 /POJK.03/2016,Perbankan,Bank Umum,Peraturan OJK,2016,Success
POJK tentang Prinsip Kehati-hatian dalam Melaksanakan Kegiatan Structured Product bagi Bank Umum,/id/regulasi/Pages/POJK-tentang-Prinsip-Kehati-hatian-dalam-Melaksanakan-Kegiatan-Structured-Product-bagi-Bank-Umum.aspx,POJK tentang Prinsip Kehati-hatian dalam Melaksanakan Kegiatan Structured Product bagi Bank Umum,7 /POJK.03/2016,Perbankan,Bank Umum,Peraturan OJK,2016,Success
POJK tentang Kegiatan Usaha dan Jaringan Kantor Berdasarkan Modal Inti Bank,/id/regulasi/Pages/POJK-tentang-Kegiatan-Usaha-dan-Jaringan-Kantor-Berdasarkan-Modal-Inti-Bank.aspx,POJK tentang Kegiatan Usaha dan Jaringan Kantor Berdasarkan Modal Inti Bank,6 /POJK.03/2016,Perbankan,"Bank Umum, Perbankan Syariah",Peraturan OJK,2016,Success
POJK tentang Rencana Bisnis Bank,/id/regulasi/Pages/POJK-tentang-Rencana-Bisnis-Bank.aspx,POJK tentang Rencana Bisnis Bank,5 /POJK.03/2016,"Perbankan, Syariah","Bank Umum, Perbankan Syariah",Peraturan OJK,2016,Success
POJK tentang Penilaian Tingkat Kesehatan Bank Umum,/id/regulasi/Pages/POJK-tentang-Penilaian-Tingkat-Kesehatan-Bank-Umum.aspx,POJK tentang Penilaian Tingkat Kesehatan Bank Umum,4 /POJK.03/2016,Perbankan,Bank Umum,Peraturan OJK,2016,Success
POJK tentang Bank Pembiayaan Rakyat Syariah,/id/regulasi/Pages/POJK-tentang-Bank-Pembiayaan-Rakyat-Syariah.aspx,POJK tentang Bank Pembiayaan Rakyat Syariah,3 /POJK.03/2016,"Perbankan, Syariah",Perbankan Syariah,Peraturan OJK,2016,Success
