Title,URL,Description,Regulation Number,Sector,Sub Sector,Regulation Type,Year,status
Rencana Bisnis Lembaga Jasa Keuangan Non Bank,/id/regulasi/Pages/Rencana-Bisnis-Lembaga-Jasa-Keuangan-Non-Bank.aspx,POJK tentang Rencana Bisnis Lembaga Jasa Keuangan NonBank.,24 /POJK.05/2019,IKNB,"Lembaga Pembiayaan, Lembaga Kliring dan Penjaminan",Peraturan OJK,2019,Success
Perubahan atas Peraturan Otoritas Jasa Keuangan Nomor 12/POJK.01/2017 tentang Penerapan Program Anti Pencucian Uang dan Pencegahan Pendanaan Terorisme di Sektor Jasa Keuangan,/id/regulasi/Pages/Penerapan-Program-Anti-Pencucian-Uang-dan-Pencegahan-Pendanaan-Terorisme-di-Sektor-Jasa-Keuangan.aspx,POJK tentang Perubahan atas Peraturan Otoritas Jasa Keuangan Nomor 12/POJK.01/2017 tentang Penerapan Program Anti Pencucian Uang dan Pencegahan Pendanaan Terorisme di Sektor Jasa Keuangan.,23 /POJK.01/2019,Perbankan,"Bank Umum, BPR, Peraturan Lainnya",Peraturan OJK,2019,Success
Sertifikasi Keahlian di Bidang Manajemen Risiko dan Sertifikasi Kualifikasi Ahli di Bidang Penjaminan atau Penjaminan Syariah pada Lembaga Penjamin,/id/regulasi/Pages/-Sertifikasi-Keahlian-di-Bidang-Manajemen-Risiko-dan-Sertifikasi-Kualifikasi-Ahli-di-Bidang-Penjaminan-atau-Penjaminan-Syar.aspx,SEOJK tentang Sertifikasi Keahlian di Bidang Manajemen Risiko dan Sertifikasi Kualifikasi Ahli di Bidang Penjaminan atau Penjaminan Syariah pada Lembaga Penjamin.,17/SEOJK.05/2019,IKNB,Lembaga Kliring dan Penjaminan,Surat Edaran OJK,2019,Success
Transaksi Efek,/id/regulasi/Pages/Transaksi-Efek.aspx,POJK tentang Transaksi Efek.,22/POJK.04/2019,Pasar Modal,Perusahaan Efek,Peraturan OJK,2019,Success
"Penggabungan, Peleburan, dan Pengambilalihan Bank Perkreditan Rakyat Dan Bank Pembiayaan Rakyat Syariah","/id/regulasi/Pages/Penggabungan,-Peleburan,-dan-Pengambilalihan-Bank-Perkreditan-Rakyat-Dan-Bank-Pembiayaan-Rakyat-Syariah.aspx","POJK tentang Penggabungan, Peleburan, dan Pengambilalihan Bank Perkreditan Rakyat dan Bank Pembiayaan Rakyat Syariah.",21/POJK.03/2019,Perbankan,"BPR, Perbankan Syariah",Peraturan OJK,2019,Success
Sistem Penilaian Tingkat Kesehatan Bank Pembiayaan Rakyat Syariah,/id/regulasi/Pages/Sistem-Penilaian-Tingkat-Kesehatan-Bank-Pembiayaan-Rakyat-Syariah.aspx,POJK tentang Sistem Penilaian Tingkat Kesehatan Bank Pembiayaan Rakyat Syariah.,20/POJK.03/2019,Perbankan,"Bank Umum, BPR, Perbankan Syariah",Peraturan OJK,2019,Success
Perubahan Atas Peraturan Otoritas Jasa Keuangan Nomor 14/POJK.05/2015 tentang Retensi Sendiri Dan Dukungan Reasuransi Dalam Negeri,/id/regulasi/Pages/Retensi-Sendiri-dan-Dukungan-Reasuransi-dalam-Negeri.aspx,POJK tentang Retensi Sendiri Dan Dukungan Reasuransi Dalam Negeri.,19 /POJK.05/2019,IKNB,Asuransi,Peraturan OJK,2019,Success
Laporan Tahunan dan Laporan Keuangan Publikasi Bank Perkreditan Rakyat,/id/regulasi/Pages/Laporan-Tahunan-dan-Laporan-Keuangan-Publikasi-Bank-Perkreditan-Rakyat.aspx,tentang Laporan Tahunan dan Laporan Keuangan Publikasi Bank Perkreditan Rakyat.,16/SEOJK.03/2019,Perbankan,BPR,Undang-Undang,2019,Success
Perusahaan Efek Daerah,/id/regulasi/Pages/Perusahaan-Efek-Daerah.aspx,POJK tentang Perusahaan Efek Daerah.,18/POJK.04/2019,Pasar Modal,Perusahaan Efek,Peraturan OJK,2019,Success
Penilaian Kembali Bagi Pihak Utama Lembaga Jasa Keuangan Non-Bank,/id/regulasi/Pages/Penilaian-Kembali-Bagi-Pihak-Utama-Lembaga-Jasa-Keuangan-Non-Bank.aspx,SEOJK tentang Penilaian Kembali Bagi Pihak Utama Lembaga Jasa Keuangan Non-Bank.,15/SEOJK.05/2019,IKNB,Lembaga Jasa Keuangan Khusus,Surat Edaran OJK,2019,Success
"Pembentukan, Susunan Keanggotaan, dan Masa Kerja Komite Pada Dewan Komisaris Perusahaan Asuransi, Perusahaan Asuransi Syariah, Perusahaan Reasuransi, dan Perusahaan Reasuransi Syariah","/id/regulasi/Pages/Pembentukan,-Susunan-Keanggotaan,-dan-Masa-Kerja-Komite-Pada-Dewan-Komisaris-Perusahaan-Asuransi,-Perusahaan-Asuransi-Syari.aspx","SEOJK tentang Pembentukan, Susunan Keanggotaan, dan Masa Kerja Komite Pada Dewan Komisaris Perusahaan Asuransi, Perusahaan Asuransi Syariah, Perusahaan Reasuransi, dan Perusahaan Reasuransi Syariah.",14/SEOJK.05/2019,IKNB,"Bank Umum, IKNB Syariah",Surat Edaran OJK,2019,Success
Perizinan Wakil Agen Penjual Efek Reksa Dana,/id/regulasi/Pages/Perizinan-Wakil-Agen-Penjual-Efek-Reksa-Dana.aspx,POJK tentang Perizinan Wakil Agen Penjual Efek Reksa Dana.,17/POJK.04/2019,Pasar Modal,Reksa Dana,Peraturan OJK,2019,Success
Penerapan Tata Kelola Bagi Bank Pembiayaan Rakyat Syariah,/id/regulasi/Pages/SEOJK-Penerapan-Tata-Kelola-Bagi-Bank-Pembiayaan-Rakyat-Syariah.aspx,SEOJK tentang Penerapan Tata Kelola Bagi Bank Pembiayaan Rakyat Syariah.,13/SEOJK.03/2019,Perbankan,"Bank Umum, BPR, Perbankan Syariah",Surat Edaran OJK,2019,Success
Penerapan Fungsi Audit Intern Bagi Bank Pembiayaan Rakyat Syariah,/id/regulasi/Pages/Penerapan-Fungsi-Audit-Intern-Bagi-Bank-Pembiayaan-Rakyat-Syariah.aspx,SEOJK tentang Penerapan Fungsi Audit Intern Bagi Bank Pembiayaan Rakyat Syariah.,12/SEOJK.03/2019,Perbankan,"Bank Umum, BPR, Perbankan Syariah",Surat Edaran OJK,2019,Success
Penerapan Fungsi Kepatuhan Bagi Bank Pembiayaan Rakyat Syariah,/id/regulasi/Pages/Penerapan-Fungsi-Kepatuhan-Bagi-Bank-Pembiayaan-Rakyat-Syariah.aspx,SEOJK tentang Penerapan Fungsi Kepatuhan Bagi Bank Pembiayaan Rakyat Syariah,11/SEOJK.03/2019,Perbankan,"Bank Umum, BPR, Perbankan Syariah",Surat Edaran OJK,2019,Success
Penerapan Manajemen Risiko Bagi Bank Pembiayaan Rakyat Syariah,/id/regulasi/Pages/Penerapan-Manajemen-Risiko-Bagi-Bank-Pembiayaan-Rakyat-Syariah-bagian-2.aspx,SEOJK tentang Penerapan Manajemen Risiko Bagi Bank Pembiayaan Rakyat Syariah.,10/SEOJK.03/2019,Perbankan,"Bank Umum, Perbankan Syariah",Surat Edaran OJK,2019,Success
Penilaian Kembali Bagi Pihak Utama Bank,/id/regulasi/Pages/Penilaian-Kembali-Bagi-Pihak-Utama-Bank.aspx,SEOJK tentang Penilaian Kembali Bagi Pihak Utama Bank.,9 /SEOJK.03/2019,Perbankan,Bank Umum,Surat Edaran OJK,2019,Success
Laporan Bulanan Bank Perkreditan Rakyat,/id/regulasi/Pages/Laporan-Bulanan-Bank-Perkreditan-Rakyat.aspx,SEOJK tentang Laporan Bulanan Bank Perkreditan Rakyat.,8/SEOJK.03/2019,Perbankan,BPR,Surat Edaran OJK,2019,Success
Pengawasan PT Permodalan Nasional Madani (Persero),/id/regulasi/Pages/Pengawasan-PT-Permodalan-Nasional-Madani-(Persero).aspx,Peraturan Otoritas Jasa Keuangan Nomor 16 /POJK.05/2019 tentang Pengawasan PT Permodalan Nasional Madani (Persero),16/POJK.05/2019,IKNB,Lembaga Jasa Keuangan Khusus,Peraturan OJK,2019,Success
Tata Kelola Dana Pensiun,/id/regulasi/Pages/Tata-Kelola-Dana-Pensiun.aspx,Peraturan Otoritas Jasa Keuangan Nomor 15/POJK.05/2019 tentang Tata Kelola Dana Pensiun,15/POJK.05/2019,IKNB,"Dana Pensiun, Peraturan Lainnya",Peraturan OJK,2019,Success
Perubahan Atas Peraturan Otoritas Jasa Keuangan Nomor 32/POJK.04/2015 tentang Penambahan Modal Perusahaan Terbuka dengan Memberikan Hak Memesan Efek Terlebih Dahulu,/id/regulasi/Pages/Perubahan-Atas-Peraturan-Otoritas-Jasa-Keuangan-Nomor-32-tentang-Penambahan-Modal-Perusahaan-Terbuka-dengan-Me.aspx,POJK tentang Perubahan Atas Peraturan Otoritas Jasa Keuangan Nomor 32/POJK.04/2015 tentang Penambahan Modal Perusahaan Terbuka dengan Memberikan Hak Memesan Efek Terlebih Dahulu,14/POJK.04/2019,Pasar Modal,Perusahaan Efek,Peraturan OJK,2019,Success
Pelaporan Bank Perkreditan Rakyat dan Bank Pembiayaan Rakyat Syariah Melalui Sistem Pelaporan Otoritas Jasa Keuangan,/id/regulasi/Pages/Pelaporan-Bank-Perkreditan-Rakyat-dan-Bank-Pembiayaan-Rakyat-Syariah-Melalui-Sistem-Pelaporan-Otoritas-Jasa-Keuangan.aspx,POJK tentang Pelaporan Bank Perkreditan Rakyat dan Bank Pembiayaan Rakyat Syariah Melalui Sistem Pelaporan Otoritas Jasa Keuangan,13/POJK.03/2019,Perbankan,"BPR, Perbankan Syariah",Peraturan OJK,2019,Success
Pelaporan Bank Umum Melalui Sistem Pelaporan Otoritas Jasa Keuangan,/id/regulasi/Pages/Pelaporan-Bank-Umum-Melalui-Sistem-Pelaporan-Otoritas-Jasa-Keuangan.aspx,POJK tentang Pelaporan Bank Umum Melalui Sistem Pelaporan Otoritas Jasa Keuangan.,12/POJK.03/2019,Perbankan,Bank Umum,Peraturan OJK,2019,Success
Prinsip Kehati-Hatian dalam Aktivitas Sekuritisasi Aset bagi Bank Umum,/id/regulasi/Pages/Prinsip-Kehati-Hatian-dalam-Aktivitas-Sekuritisasi-Aset-bagi-Bank-Umum.aspx,​Peraturan Otoritas Jasa Keuangan Nomor 11 /POJK.03/2019 tentang Prinsip Kehati-Hatian dalam Aktivitas Sekuritisasi Aset Bagi Bank Umum,11 /POJK.03/2019,Perbankan,Bank Umum,Peraturan OJK,2019,Success
Penyelenggaraan Program Pendidikan Berkelanjutan Bagi Wakil Penjamin Emisi Efek dan Wakil Perantara Pedagang Efek,/id/regulasi/Pages/Penyelenggaraan-Program-Pendidikan-Berkelanjutan-Bagi-Wakil-Penjamin-Emisi-Efek-dan-Wakil-Perantara-Pedagang-Efek.aspx,SEOJK tentang Penyelenggaraan Program Pendidikan Berkelanjutan Bagi Wakil Penjamin Emisi Efek dan Wakil Perantara Pedagang Efek.,7/SEOJK.04/2019,Pasar Modal,"Perusahaan Efek, Lembaga Penunjang Pasar Modal, Profesi Penunjang Pasar Modal, Peraturan Lainnya",Surat Edaran OJK,2019,Success
Pedoman Pembukaan Rekening Efek Nasabah dan Rekening Dana Nasabah Secara Elektronik Melalui Perusahaan Efek yang Melakukan Kegiatan Usaha Sebagai Perantara Pedagang Efek,/id/regulasi/Pages/Pedoman-Pembukaan-Rekening-Efek-Nasabah-dan-Rekening-Dana-Nasabah-Secara-Elektronik-.aspx,SEOJK tentang Pedoman Pembukaan Rekening Efek Nasabah dan Rekening Dana Nasabah Secara Elektronik Melalui Perusahaan Efek yang Melakukan Kegiatan Usaha Sebagai Perantara Pedagang Efek.,6/SEOJK.04/2019,Pasar Modal,"Bursa Efek, Perusahaan Efek",Surat Edaran OJK,2019,Success
"Bentuk, Susunan, dan Tata Cara Penyampaian Laporan Berkala bagi Pelaku Usaha Pergadaian dan Perusahaan Pergadaian","/id/regulasi/Pages/Bentuk,-Susunan,-dan-Tata-Cara-Penyampaian-Laporan-Berkala-bagi-Pelaku-Usaha-Pergadaian-dan-Perusahaan-Pergadaian.aspx","SEOJK tentang Bentuk, Susunan, dan Tata Cara Penyampaian Laporan Berkala bagi Pelaku Usaha Pergadaian dan Perusahaan Pergadaian",5/SEOJK.05/2019,IKNB,Lembaga Jasa Keuangan Khusus,Surat Edaran OJK,2019,Success
Bentuk dan Susunan Laporan Berkala Dana Pensiun yang Menyelenggakan Program Pensiun Berdasarkan Prinsip Syariah,/id/regulasi/Pages/Bentuk-dan-Susunan-Laporan-Berkala-Dana-Pensiun-yang-Menyelenggaraan-Program-Pensiun-Berdasarkan-Prinsip-Syariah.aspx,SEOJK tentang Bentuk dan Susunan Laporan Berkala Dana Pensiun yang Menyelenggaraan Program Pensiun Berdasarkan Prinsip Syariah,4/SEOJK.05/2019,IKNB,"IKNB Syariah, Dana Pensiun",Surat Edaran OJK,2019,Success
Bentuk dan Susunan Laporan Berkala Dana Pensiun,/id/regulasi/Pages/Bentuk-dan-Susunan-Laporan-Berkala-Dana-Pensiun.aspx,SEOJK tentang Bentuk dan Susunan Laporan Berkala Dana Pensiun,3/SEOJK.05/2019,IKNB,Dana Pensiun,Surat Edaran OJK,2019,Success
Penyelenggaraan Usaha Perusahaan Pembiayaan Syariah dan Unit Usaha Syariah Perusahaan Pembiayaan,/id/regulasi/Pages/Penyelenggaraan-Usaha-Perusahaan-Pembiayaan-Syariah-dan-Unit-Usaha-Syariah-Perusahaan-Pembiayaan.aspx,POJK tentang Penyelenggaraan Usaha Perusahaan Pembiayaan Syariah dan Unit Usaha Syariah Perusahaan Pembiayaan,10/POJK.05/2019,IKNB,"IKNB Syariah, Lembaga Pembiayaan",Peraturan OJK,2019,Success
Perantara Pedagang Efek untuk Efek Bersifat Utang dan Sukuk ,/id/regulasi/Pages/Perantara-Pedagang-Efek-untuk-Efek-Bersifat-Utang-dan-Sukuk-.aspx,POJK tentang Perantara Pedagang Efek untuk Efek Bersifat Utang dan Sukuk.,9/POJK.04/2019,Pasar Modal,"Bursa Efek, Perusahaan Efek, Wakil Perusahaan Efek",Peraturan OJK,2019,Success
Penyelenggara Pasar Alternatif,/id/regulasi/Pages/Penyelenggara-Pasar-Alternatif.aspx,​Peraturan Otoritas Jasa Keuangan Nomor 8/POJK.04/2019 tentang Penyelenggara Pasar Alternatif,8/POJK.04/2019,Pasar Modal,Bursa Efek,Peraturan OJK,2019,Success
"Promosi Pemasaran Efek Termasuk Iklan, Brosur, atau Komunikasi Lainnya kepada Publik","/id/regulasi/Pages/Promosi-Pemasaran-Efek-Termasuk-Iklan,-Brosur,-atau-Komunikasi-Lainnya-kepada-Publik.aspx","POJK tentang Promosi Pemasaran Efek Termasuk Iklan, Brosur, atau Komunikasi Lainnya Kepada Publik",7 /POJK.04/2019,Pasar Modal,"Perusahaan Efek, Peraturan Lainnya",Peraturan OJK,2019,Success
Stabilisasi Harga untuk Mempermudah Penawaran Umum,/id/regulasi/Pages/-Stabilisasi-Harga-untuk-Mempermudah-Penawaran-Umum.aspx,POJK tentang Stabilisasi Harga untuk Mempermudah Penawaran Umum,6 /POJK.04/2019,Pasar Modal,Peraturan Lainnya,Peraturan OJK,2019,Success
Perilaku yang Dilarang bagi Penasihat Investasi,/id/regulasi/Pages/Perilaku-yang-Dilarang-bagi-Penasihat-Investasi.aspx,POJK tentang Perilaku Yang Dilarang Bagi Penasihat Investasi,5 /POJK.04/2019,Pasar Modal,Penasehat Investasi,Peraturan OJK,2019,Success
Tata Cara Pemberian Persetujuan Anggaran Dasar Lembaga Penyimpanan dan Penyelesaian,/id/regulasi/Pages/Tata-Cara-Pemberian-Persetujuan-Anggaran-Dasar-Lembaga-Penyimpanan-dan-Penyelesaian.aspx,POJK tentang Tata Cara Pemberian Persetujuan Anggaran Dasar Lembaga Penyimpanan dan Penyelesaian,4 /POJK.04/2019,Pasar Modal,Lembaga Penyimpanan dan Penyelesaian,Peraturan OJK,2019,Success
Tata Cara Pemberian Persetujuan Anggaran Dasar Lembaga Kliring dan Penjaminan,/id/regulasi/Pages/Tata-Cara-Pemberian-Persetujuan-Anggaran-Dasar-Lembaga-Kliring-dan-Penjaminan.aspx,POJK tentang Tata Cara Pemberian Persetujuan Anggaran Dasar Lembaga Kliring Dan Penjaminan,3 /POJK.04/2019,Pasar Modal,Lembaga Kliring dan Penjaminan,Peraturan OJK,2019,Success
Tata Cara Pemberian Persetujuan Anggaran Dasar Bursa Efek,/id/regulasi/Pages/Tata-Cara-Pemberian-Persetujuan-Anggaran-Dasar-Bursa-Efek.aspx,POJK tentang Tata Cara Pemberian Persetujuan Anggaran Dasar Bursa Efek,2 /POJK.04/2019,Pasar Modal,Bursa Efek,Peraturan OJK,2019,Success
Penerapan Fungsi Audit Intern pada Bank Umum,/id/regulasi/Pages/Penerapan-Fungsi-Audit-Intern-pada-Bank-Umum.aspx,POJK tentang Penerapan Fungsi Audit Intern pada Bank Umum.,1/POJK.03/2019,Perbankan,Bank Umum,Peraturan OJK,2019,Success
Bentuk dan Susunan Laporan Aktuaris Tahunan Badan Penyelenggara Jaminan Sosial Kesehatan dan Badan Penyelenggara Jaminan ,/id/regulasi/Pages/Bentuk-dan-Susunan-Laporan-Aktuaris-Tahunan-Badan-Penyelenggara-Jaminan-Sosial-Kesehatan-dan-Badan-Penyelenggara-Jaminan-.aspx,SEOJK tentang  Bentuk dan Susunan Laporan Aktuaris Tahunan Badan Penyelenggara Jaminan Sosial Kesehatan dan  Badan Penyelenggara Jaminan Sosial Ketenagakerjaan.,2/SEOJK.05/2019,IKNB,Asuransi,Surat Edaran OJK,2019,Success
Penerapan Manajemen Risiko Bagi Bank Perkreditan Rakyat,/id/regulasi/Pages/Penerapan-Manajemen-Risiko-bagi-Bank-Perkreditan-Rakyat.aspx,SEOJK tentang Penerapan Manajemen Risiko Bagi Bank Perkreditan Rakyat.,1/SEOJK.03/2019,Perbankan,BPR,Surat Edaran OJK,2019,Success
Perizinan Perusahaan Pemeringkat Efek,/id/regulasi/Pages/Perizinan-Perusahaan-Pemeringkat-Efek.aspx,POJK tentang Perizinan Perusahaan Pemeringkat Efek,38/POJK.04/2018,Pasar Modal,Lembaga Penunjang Pasar Modal,Peraturan OJK,2018,Success
Layanan Urun Dana Melalui Penawaran Saham Berbasis Teknologi Informasi (Equity Crowdfunding),/id/regulasi/Pages/Layanan-Urun-Dana-Melalui-Penawaran-Saham-Berbasis-Teknologi-Informasi-(Equity-Crowdfunding).aspx,Peraturan Otoritas Jasa Keuangan Nomor 37/POJK.04/2018 tentang Layanan Urun Dana Melalui Penawaran Saham Berbasis Teknologi Informasi (Equity Crowdfunding),37/POJK.04/2018,Pasar Modal,Lembaga Penunjang Pasar Modal,Peraturan OJK,2018,Success
Penilaian Kembali Bagi Pihak Utama Lembaga Jasa Keuangan,/id/regulasi/Pages/Penilaian-Kembali-Bagi-Pihak-Utama-Lembaga-Jasa-Keuangan.aspx,"Peraturan Otoritas Jasa Keuangan Nomor 34/POJK.03/2018 
tentang Penilaian Kembali Bagi Pihak Utama Lembaga Jasa Keuangan",34/POJK.03/2018,"Perbankan, Pasar Modal, IKNB, Syariah","Bank Umum, BPR, Pasar Modal Syariah, IKNB Syariah, Perbankan Syariah, Asuransi, Dana Pensiun, Lembaga Pembiayaan, Lembaga Jasa Keuangan Khusus, Perusahaan Efek, Penasehat Investasi",Peraturan OJK,2018,Success
Penyelenggaraan Usaha Perusahaan Pembiayaan,/id/regulasi/Pages/Penyelenggaraan-Usaha-Perusahaan-Pembiayaan.aspx,POJK tentang Penyelenggaraan Usaha Perusahaan Pembiayaan,35/POJK.05/2018,IKNB,Lembaga Pembiayaan,Peraturan OJK,2018,Success
Kualitas Aset Produktif dan Pembentukan Penyisihan Penghapusan Aset Produktif Bank Perkreditan Rakyat,/id/regulasi/Pages/Kualitas-Aset-Produktif-dan-Pembentukan-Penyisihan-Penghapusan-Aset-Produktif-Bank-Perkreditan-Rakyat.aspx,POJK tentang Kualitas Aset Produktif dan Pembentukan Penyisihan Penghapusan Aset Produktif Bank Perkreditan Rakyat,33 /POJK.03/2018,Perbankan,BPR,Peraturan OJK,2018,Success
Tata Cara Pemeriksaan di Sektor Pasar Modal,/id/regulasi/Pages/Tata-Cara-Pemeriksaan-di-Sektor-Pasar-Modal.aspx,POJK tentang Tata Cara Pemeriksaan di Sektor Pasar Modal,36/POJK.04/2018,Pasar Modal,"Pasar Modal Syariah, Perusahaan Efek, Wakil Perusahaan Efek, Penasehat Investasi, Lembaga Penunjang Pasar Modal, Profesi Penunjang Pasar Modal, Emiten dan Perusahaan Publik",Peraturan OJK,2018,Success
Batas Maksimum Pemberian Kredit dan Penyediaan Dana Besar Bagi Bank Umum,/id/regulasi/Pages/Batas-Maksimum-Pemberian-Kredit-dan-Penyediaan-Dana-Besar-Bagi-Bank-Umum.aspx,Peraturan Otoritas Jasa Keuangan Nomor 32/POJK.03/2018 tentang Batas Maksimum Pemberian Kredit Dan Penyediaan Dana Besar Bagi Bank Umum,32/POJK.03/2018,Perbankan,Bank Umum,Peraturan OJK,2018,Success
"Permohonan Perizinan, Persetujuan, dan Pelaporan Bagi Lembaga Penjamin dan Pendaftaran Bagi Lembaga Penunjang Penjaminan ","/id/regulasi/Pages/Permohonan-Perizinan,-Persetujuan,-dan-Pelaporan-Bagi-Lembaga-Penjamin-dan-Pendaftaran-Bagi-Lembaga-Penunjang-Penjaminan-.aspx","Surat Edaran Otoritas Jasa Keuangan  Nomor 20/SEOJK.05/2018 tentang Permohonan Perizinan, Persetujuan, dan Pelaporan Bagi Lembaga Penjamin dan Pendaftaran Bagi Lembaga Penunjang Penjaminan Secara Elektronik.",20/SEOJK.05/2018,IKNB,Lembaga Jasa Keuangan Khusus,Surat Edaran OJK,2018,Success
Laporan Penerapan Tata Kelola Manajer Investasi,/id/regulasi/Pages/Laporan-Penerapan-Tata-Kelola-Manajer-Investasi.aspx,SEOJK tentang Laporan Penerapan Tata Kelola Manajer Investasi,19 /SEOJK.04/2018,Pasar Modal,"Bursa Efek, Profesi Penunjang Pasar Modal",Surat Edaran OJK,2018,Success
Kesehatan Keuangan Lembaga Penjamin,/id/regulasi/Pages/Kesehatan-Keuangan-Lembaga-Penjamin.aspx,Surat Edaran Otoritas Jasa Keuangan Nomor 18/SEOJK.05/2018 tentang Kesehatan Keuangan Lembaga Penjamin.,18/SEOJK.05/2018,IKNB,Lembaga Jasa Keuangan Khusus,Surat Edaran OJK,2018,Success
Perizinan Wakil Manajer Investasi,/id/regulasi/Pages/Perizinan-Wakil-Manajer-Investasi.aspx,Peraturan Otoritas Jasa Keuangan Nomor 31/POJK.04/2018 tentang Perizinan Wakil Manajer Investasi,31/POJK.04/2018,Pasar Modal,Profesi Penunjang Pasar Modal,Peraturan OJK,2018,Success
Perubahan atas POJK tentang Penyelenggaraan Usaha Lembaga Penjamin,/id/regulasi/Pages/Perubahan-atas-POJK-tentang-Penyelenggaraan-Usaha-Lembaga-Penjamin.aspx,POJK tentang Perubahan atas Nomor 2/POJK.05/2017 tentang Penyelenggaraan Usaha Lembaga Penjamin,30/POJK.05/2018,IKNB,Lembaga Kliring dan Penjaminan,Peraturan OJK,2018,Success
Perubahan atas POJK tentang Investasi Dana Pensiun,/id/regulasi/Pages/Perubahan-atas-POJK-tentang-Investasi-Dana-Pensiun.aspx,POJK tentang Perubahan atas POJK Nomor 3/POJK.05/2015 tentang Investasi Dana Pensiun,29/POJK.05/2018,IKNB,Dana Pensiun,Peraturan OJK,2018,Success
Perubahan atas POJK tentang Kesehatan Keuangan Perusahaan Asuransi dan Perusahaan Reasuransi dengan Prinsip Syariah,/id/regulasi/Pages/Perubahan-atas-POJK-tentang-Kesehatan-Keuangan-Perusahaan-Asuransi-dan-Perusahaan-Reasuransi-dengan-Prinsip-Syariah.aspx,POJK tentang Perubahan atas POJK Nomor 72/POJK.05/2016 tentang Kesehatan Keuangan Perusahaan Asuransi dan Perusahaan Reasuransi dengan Prinsip Syariah,28/POJK.05/2018,IKNB,"IKNB Syariah, Asuransi",Peraturan OJK,2018,Success
Perubahan atas POJK tentang Kesehatan Keuangan Perusahaan Asuransi dan Perusahaan Reasuransi,/id/regulasi/Pages/Perubahan-atas-POJK-tentang-Kesehatan-Keuangan-Perusahaan-Asuransi-dan-Perusahaan-Reasuransi.aspx,POJK tentang Perubahan atas POJK Nomor 71/POJK.05/2016 tentang Kesehatan Keuangan Perusahaan Asuransi dan Perusahaan Reasuransi,27/POJK.05/2018,IKNB,Asuransi,Peraturan OJK,2018,Success
Perubahan Kedua POJK tentang Tata Cara Penagihan Sanksi Administratif Berupa Denda di Sektor Jasa Keuangan,/id/regulasi/Pages/Perubahan-Kedua-POJK-tentang-Tata-Cara-Penagihan-Sanksi-Administratif-Berupa-Denda-di-Sektor-Jasa-Keuangan.aspx,POJK tentang Perubahan Kedua atas POJK Nomor 4/POJK.04/2014 tentang Tata Cara Penagihan Sanksi Administratif Berupa Denda di Sektor Jasa Keuangan,26/POJK.02/2018,IKNB,Sanksi,Peraturan OJK,2018,Success
Penerapan Tata Kelola bagi Bank Pembiayaan Rakyat Syariah,/id/regulasi/Pages/Penerapan-Tata-Kelola-bagi-Bank-Pembiayaan-Rakyat-Syariah.aspx,POJK tentang Penerapan Tata Kelola bagi Bank Pembiayaan Rakyat Syariah,24/POJK.03/2018,Perbankan,"BPR, Perbankan Syariah",Peraturan OJK,2018,Success
Penerapan Manajemen Risiko bagi Bank Pembiayaan Rakyat Syariah,/id/regulasi/Pages/Penerapan-Manajemen-Risiko-bagi-Bank-Pembiayaan-Rakyat-Syariah.aspx,POJK tentang Penerapan Manajemen Risiko bagi Bank Pembiayaan Rakyat Syariah,23/POJK.03/2018,Perbankan,"BPR, Perbankan Syariah",Peraturan OJK,2018,Success
Perubahan atas POJK Nomor 3/POJK.02/2014 tentang Tata Cara Pelaksanaan Pungutan oleh Otoritas Jasa Keuangan,/id/regulasi/Pages/Perubahan-POJK-Nomor-3-POJK.02-2014-tentang-Tata-Cara-Pelaksanaan-Pungutan-oleh-OJK.aspx,POJK tentang Perubahan atas POJK Nomor 3/POJK.02/2014 tentang Tata Cara Pelaksanaan Pungutan oleh OJK,22/POJK.02/2018,"Perbankan, Pasar Modal, IKNB, Syariah, EPK",Peraturan Lainnya,Peraturan OJK,2018,Success
Lembaga Pendanaan Efek,/id/regulasi/Pages/Lembaga-Pendanaan-Efek.aspx,POJK tentang Lembaga Pendanaan Efek,25/POJK.04/2018,Pasar Modal,Bursa Efek,Peraturan OJK,2018,Success
Pedoman Pelaksanaan Layanan Pengaduan Konsumen di Sektor Jasa Keuangan,/id/regulasi/Pages/Pedoman-Pelaksanaan-Layanan-Pengaduan-Konsumen-di-Sektor-Jasa-Keuangan.aspx,SEOJK tentang Pedoman Pelaksanaan Layanan Pengaduan Konsumen di Sektor Jasa Keuangan,17/SEOJK.07/2018,EPK,Peraturan Lainnya,Surat Edaran OJK,2018,Success
"Pedoman Penyusunan Neraca Sementara Likuidasi Perusahaan Asuransi, Perusahaan Asuransi Syariah, Perusahaan Reasuransi, dan Perusahaan Reasuransi Syariah","/id/regulasi/Pages/Pedoman-Penyusunan-Neraca-Sementara-Likuidasi-Perusahaan-Asuransi,-Asuransi-Syariah,-Reasuransi,-dan-Reasuransi-Syariah.aspx","SEOJK tentang Pedoman Penyusunan Neraca Sementara Likuidasi Perusahaan Asuransi, Perusahaan Asuransi Syariah, Perusahaan Reasuransi, dan Perusahaan Reasuransi Syariah",16/SEOJK.05/2018,IKNB,Asuransi,Surat Edaran OJK,2018,Success
"Pedoman Penyusunan Rencana Kerja Anggaran Biaya Likuidasi Pemberian Insentif yang Wajar untuk Tim Likuidasi Perusahaan Asuransi, Perusahaan Asuransi Syariah, Perusahaan Reasuransi, dan Perusahaan Reasuransi Syariah",/id/regulasi/Pages/Pedoman-Penyusunan-Rencana-Kerja-Anggaran-Biaya-Likuidasi-Pemberian-Insentif-yg-Wajar-utk-Tim-Likuidasi-Perusahaan-Asuransi.aspx,"SEOJK tentang Pedoman Penyusunan Rencana Kerja dan Anggaran Biaya Likuidasi serta Pemberian Insentif yang Wajar untuk Tim Likuidasi bagi Perusahaan Asuransi, Perusahaan Asuransi Syariah, Perusahaan Reasuransi, dan Perusahaan Reasuransi Syariah",15/SEOJK.05/2018,IKNB,Asuransi,Surat Edaran OJK,2018,Success
Waktu Penyelesaian Transaksi Bursa,/id/regulasi/Pages/Waktu-Penyelesaian-Transaksi-Bursa.aspx,POJK tentang Waktu Penyelesaian Transaksi Bursa,21/POJK.04/2018,Pasar Modal,Bursa Efek,Peraturan OJK,2018,Success
Perizinan Wakil Penjamin Emisi Efek dan Wakil Perantara Pedagang Efek,/id/regulasi/Pages/Perizinan-Wakil-Penjamin-Emisi-Efek-dan-Wakil-Perantara-Pedagang-Efek.aspx,"POJK tentang Perizinan Wakil Penjamin Emisi Efek dan Wakil Perantara
Pedagang Efek",20/POJK.04/2018,Pasar Modal,"Perusahaan Efek, Wakil Perusahaan Efek",Peraturan OJK,2018,Success
Kegiatan Lain bagi Perusahaan Efek yang Melakukan Kegiatan Usaha sebagai Penjamin Emisi Efek dan Perantara Pedagang Efek,/id/regulasi/Pages/Kegiatan-Lain-bagi-Perusahaan-Efek-yang-Melakukan-Kegiatan-Usaha-sebagai-Penjamin-Emisi-Efek-dan-Perantara-Pedagang-Efek.aspx,SEOJK tentang Kegiatan Lain bagi Perusahaan Efek yang Melakukan Kegiatan Usaha sebagai Penjamin Emisi Efek dan Perantara Pedagang Efek,14/SEOJK.04/2018,Pasar Modal,"Bursa Efek, Perusahaan Efek, Wakil Perusahaan Efek",Surat Edaran OJK,2018,Success
Perubahan SEOJK tentang Perhitungan Aset Tertimbang Menurut Risiko untuk Risiko Kredit dengan Menggunakan Pendekatan Standar bagi Bank Umum Syariah,/id/regulasi/Pages/Perubahan-SEOJK-Perhitungan-Aset-Tertimbang-Menurut-Risiko-utk-Risiko-Kredit-dg-Pendekatan-Standar-bagi-Bank-Umum-Syariah.aspx,SEOJK tentang Perubahan atas SEOJK Nomor 34/SEOJK.03/2015 tentang Perhitungan Aset Tertimbang Menurut Risiko untuk Risiko Kredit dengan Menggunakan Pendekatan Standar bagi Bank Umum Syariah,13/SEOJK.03/2018,Perbankan,Perbankan Syariah,Surat Edaran OJK,2018,Success
Perubahan POJK tentang Penilaian Kualitas Aset Bank Umum Syariah dan Unit Usaha Syariah,/id/regulasi/Pages/Perubahan-POJK-tentang-Penilaian-Kualitas-Aset-Bank-Umum-Syariah-dan-Unit-Usaha-Syariah.aspx,POJK tentang Perubahan atas POJK Nomor 16/POJK.03/2014 tentang Penilaian Kualitas Aset Bank Umum Syariah dan Unit Usaha Syariah,19/POJK.03/2018,Perbankan,Perbankan Syariah,Peraturan OJK,2018,Success
Layanan Pengaduan Konsumen di Sektor Jasa Keuangan,/id/regulasi/Pages/Layanan-Pengaduan-Konsumen-di-Sektor-Jasa-Keuangan.aspx,POJK tentang Layanan Pengaduan Konsumen di Sektor Jasa Keuangan,18/POJK.07/2018,EPK,Peraturan Lainnya,Peraturan OJK,2018,Success
Penerapan Manajemen Risiko dan Pengukuran Risiko Pendekatan Standar untuk Risiko Suku Bunga dalam Banking Book bagi Bank Umum,/id/regulasi/Pages/Penerapan-Manajemen-Risiko-Pengukuran-Risiko-Pendekatan-Standar-untuk-Risiko-Suku-Bunga-dalam-Banking-Book-bagi-Bank-Umum.aspx,"SEOJK tentang
Penerapan Manajemen Risiko dan Pengukuran Risiko Pendekatan Standar untuk Risiko Suku Bunga dalam Banking Book (Interest Rate Risk in The Banking Book) bagi Bank Umum",12/SEOJK.03/2018,Perbankan,Bank Umum,Surat Edaran OJK,2018,Success
